{
  "id": "task_authorization_crapi_vehicle_location_001",
  "class": "authorization",
  "subtype": "bola",
  "endpoint": "/identity/api/v2/vehicle/{id}/location",
  "method": "GET",
  "params": {
    "path_params": ["id"],
    "query_params": [],
    "body_fields": [],
    "object_id_candidates": ["4bae9968-ec7f-4de3-a3a0-ba1b2ab5e5e5"],
    "selected_object_id": "4bae9968-ec7f-4de3-a3a0-ba1b2ab5e5e5",
    "requires_object_id_enrichment": false,
    "object_param_name": "carId"
  },
  "auth_context": {
    "owner_role": "user_a",
    "other_role": "user_b",
    "token_strategy": "cross_role_replay"
  },
  "hypothesis": "Cross-role access to the same vehicle object may be possible.",
  "priority": 100,
  "retry_count": 0,
  "rework_hint": null,
  "status": "pending",
  "allowed_tools": ["auth_test_access"]
}
